{
  "version": "atg.gatepass-core.local.v1",
  "iss": "issuer_local_gatepass_demo",
  "sub": "local_demo_agent_or_workflow",
  "aud": "agent_trust_gate_local_verifier",
  "jti": "gatepass_core_pre_settlement_valid_001",
  "iat": "2026-07-11T09:00:00.000Z",
  "exp": "2030-01-01T00:00:00.000Z",
  "nonce": "nonce_gatepass_core_base_001",
  "mandate": {
    "id": "mandate_pre_settlement_local_review",
    "allowedAction": "pre_settlement_review",
    "issuerReference": "issuer_local_gatepass_demo",
    "status": "present"
  },
  "scope": {
    "permittedActions": [
      "pre_settlement_review"
    ],
    "constraints": [
      "local_demo_only",
      "no_real_settlement",
      "signed_gatepass_required"
    ],
    "settlementSensitive": true
  },
  "evidence": {
    "refs": [
      "evidence_pre_settlement_local_review"
    ],
    "status": "present"
  },
  "intent": {
    "status": "verified",
    "context": "local demo intent verified for bounded review"
  },
  "risk": {
    "tier": "critical",
    "sensitiveToolCall": true,
    "highRiskAction": true
  },
  "approval": {
    "required": true,
    "status": "approved",
    "approverReference": "local_human_pre_settlement_review_001"
  },
  "signature": {
    "status": "present",
    "proofReference": "local_signed_gatepass_pre_settlement_demo",
    "alg": "local-demo-placeholder",
    "productionSigning": false
  },
  "localDemoOnly": true,
  "localOnly": true,
  "liveSystemsContact": false,
  "directBotMessaging": false,
  "autonomousOutreach": false,
  "outreachAutomation": false,
  "liveAgentToAgentCommunication": false,
  "externalAgentContact": false,
  "liveApi": false,
  "mcpServer": false,
  "cloudNetworkCall": false,
  "secretsOrCredentials": false,
  "paymentAuthorisation": false,
  "settlementAuthorisation": false,
  "walletBankingLogic": false,
  "productionSigning": false,
  "productionGradeCrypto": false,
  "productionCertification": false,
  "actionExecution": false,
  "extensions": {
    "preSettlement": {
      "settlementSensitive": true,
      "requiresSignedGatePass": true,
      "blockerReference": "local_pre_settlement_blocker_demo",
      "noSignedGatePassNoSettlement": true
    }
  }
}
